{
  "aiu_version": "0.1.0",
  "cards": {
    "by_level": {
      "A": 10,
      "B": 14,
      "C": 19,
      "D": 15,
      "E": 7,
      "F": 10
    },
    "drafted": 75
  },
  "cumulative_cost_usd": 0.1704,
  "generated_at": "2026-10-25T01:01:28Z",
  "known_gaps": [
    {
      "ticket": "T-038",
      "title": "Run final v1 acceptance"
    }
  ],
  "labs": {
    "runnable": 5,
    "total": 17
  },
  "last_live_run": "20261025T001745Z-live-b1c296",
  "last_verified": null,
  "ledger": {
    "disputed": 0,
    "total": 84,
    "unverified": 84,
    "verified": 0
  },
  "live_runs": {
    "aborted": 0,
    "completed": 15,
    "failed": 0,
    "total": 15
  },
  "modules": {
    "authored": 13,
    "total": 13
  },
  "schema_version": 1,
  "stage": "building",
  "tests": {
    "at": "2026-10-25T01:01:27Z",
    "failed": 0,
    "passed": 206
  }
}
