{
  "schema_version": 1,
  "aiu_version": "0.1.0",
  "generated_at": "2026-10-24T00:00:00Z",
  "stage": "architecture",
  "cards": { "drafted": 3, "by_level": { "A": 1, "B": 1, "C": 1, "D": 0, "E": 0, "F": 0 } },
  "labs": { "total": 17, "runnable": 0 },
  "modules": { "total": 13, "authored": 0 },
  "live_runs": { "total": 0, "completed": 0, "aborted": 0, "failed": 0 },
  "cumulative_cost_usd": 0.0,
  "ledger": { "total": 13, "unverified": 13, "verified": 0, "disputed": 0 },
  "last_verified": null,
  "known_gaps": [
    { "ticket": "T-001", "title": "Create repository and install spec documents" },
    { "ticket": "T-002", "title": "Bootstrap Python 3.12, uv, and package skeleton" },
    { "ticket": "T-003", "title": "Add .gitignore and .env.example" },
    { "ticket": "T-004", "title": "Implement secrets and forbidden-file scanner with pre-commit hook" },
    { "ticket": "T-005", "title": "Implement append-only journal check" },
    { "ticket": "T-006", "title": "Implement YAML schema validation command" },
    { "ticket": "T-007", "title": "Implement status.json generation, README block, and consistency check" },
    { "ticket": "T-008", "title": "Implement config loading and core pydantic models" },
    { "ticket": "T-009", "title": "Implement hardware check" },
    { "ticket": "T-010", "title": "Implement metrics library" },
    { "ticket": "T-011", "title": "Implement cost estimator and CostGuard" },
    { "ticket": "T-012", "title": "Implement client interface and FixtureClient" },
    { "ticket": "T-013", "title": "Implement OpenRouterClient with retries and mock-transport tests" },
    { "ticket": "T-014", "title": "Implement run IDs, `lab new-run`, and the prediction gate" },
    { "ticket": "T-015", "title": "Implement the lab registry, runner engine, and `lab run` / `lab estimate`" },
    { "ticket": "T-016", "title": "Implement post-mortem check" },
    { "ticket": "T-017", "title": "Author all 17 lab manifests and implement `labs list` / `labs check-tiers`" },
    { "ticket": "T-018", "title": "Implement dataset build and synthetic fixture framework" },
    { "ticket": "T-019", "title": "Implement lab L-003 (eval statistics workbench)" },
    { "ticket": "T-020", "title": "Implement lab E9 (context distractors and position)" },
    { "ticket": "T-021", "title": "Implement lab E2 (schema field order)" },
    { "ticket": "T-022", "title": "Implement lab E4 (escape hatch)" },
    { "ticket": "T-023", "title": "Implement lab E5 (position and verbosity bias)" },
    { "ticket": "T-024", "title": "Implement smoke suite with total cost cap" },
    { "ticket": "T-025", "title": "Implement module checkpoint grader" },
    { "ticket": "T-026", "title": "Implement provenance ledger check" },
    { "ticket": "T-027", "title": "Implement traceability check" },
    { "ticket": "T-028", "title": "Author the 13 module YAML files" },
    { "ticket": "T-029", "title": "Author level A cards A-002..A-010" },
    { "ticket": "T-030", "title": "Author level B cards B-002..B-014" },
    { "ticket": "T-031", "title": "Author level C cards (18 remaining)" },
    { "ticket": "T-032", "title": "Author level D and E cards" },
    { "ticket": "T-033", "title": "Author level F cards and close traceability" },
    { "ticket": "T-034", "title": "Write learner guide and M-A1 walkthrough" },
    { "ticket": "T-035", "title": "Implement repo-layout test and `aiu check-all`" },
    { "ticket": "T-036", "title": "Pin models and prices, recompute expected costs, and run live smoke" },
    { "ticket": "T-037", "title": "Complete module M-A1 end-to-end with a live E9 run" },
    { "ticket": "T-038", "title": "Run final v1 acceptance" }
  ]
}
